{
  "id":"lesson-unit-01a","schema_version":"1.0.0","content_version":"0.1.0","title":"1A 文字と基本の読み方","created_at":"2026-08-25T12:00:00+09:00","updated_at":"2026-08-25T12:00:00+09:00","unit_id":"unit-01a","purpose":"文字・音価・i/jとu/vの表記差を区別する。","skills":["orth.alphabet.classical-basic","orth.i-j.variant-recognize","orth.u-v.variant-recognize","phon.letter-sound.classical-basic","phon.word.read-aloud.basic"],"vocabulary":["lex-caesar","lex-roma","lex-vir","lex-ius"],
  "blocks":[{"block_id":"objective","kind":"objective","new_concept_count":0,"skill_refs":["orth.alphabet.classical-basic"],"status":"review-ready"},{"block_id":"reconstructed-pronunciation","kind":"explanation","new_concept_count":1,"skill_refs":["phon.letter-sound.classical-basic"],"status":"review-ready"},{"block_id":"letters-and-sounds","kind":"formal-table","new_concept_count":1,"skill_refs":["orth.alphabet.classical-basic","phon.letter-sound.classical-basic"],"status":"review-ready"},{"block_id":"ij-uv","kind":"explanation","new_concept_count":1,"skill_refs":["orth.i-j.variant-recognize","orth.u-v.variant-recognize"],"status":"review-ready"},{"block_id":"reading-practice","kind":"practice-link","new_concept_count":0,"skill_refs":["phon.word.read-aloud.basic"],"status":"review-ready"}],
  "source_refs":[{"bibliography_id":"src-lat-ag-dcc","locator":{"section":"§1 Alphabet","url_fragment":"#alphabet"},"claim_scope":"古典期のI/Vと現代版のJ/U表記","quotation_used":false,"verification_status":"relevant-section-verified","verification_note":"2026-08-25にDCCのAlphabet本文を直接確認した。","use_mode":"summary"},{"bibliography_id":"src-lat-ag-dcc","locator":{"section":"§8 Vowel and Consonant Pronunciation","url_fragment":"#vowel-and-consonant-pronunciation"},"claim_scope":"復元発音の限界と基本子音音価","quotation_used":false,"verification_status":"relevant-section-verified","verification_note":"2026-08-25にDCCの該当本文を直接確認した。","use_mode":"summary"}],
  "evidence":[{"kind":"source-summary","claim_scope":"1Aの主要説明","note":"DCC版A&G §§1, 8の要約。長い転載なし。"}],
  "review":{"draft_status":"ready-for-review","source_checked":[{"id":"review-source-unit-01a-v1","kind":"source-checked","result":"pass","reviewer_type":"codex","reviewer_display_name":"Codex","reviewed_at":"2026-08-25T12:00:00+09:00","reviewed_content_version":"0.1.0","scope":["復元古典式の位置づけ","基本音価","i/jとu/vの歴史的・編集上の区別"],"notes":"該当DCC本文を直接確認。編集上の平易さ・発音実演は未承認。","evidence_refs":["src-lat-ag-dcc"],"active":true}],"editorial_approved":[],"expert_reviewed":[],"automated_validation":[]},"notes":"音声ファイルなし。音読技能は人間確認を要する。"
}
