{"id":"lesson-fixture-01","schema_version":"1.0.0","content_version":"0.1.0","title":"fixture lesson","created_at":"2026-08-24T00:00:00+09:00","updated_at":"2026-08-24T00:00:00+09:00","unit_id":"unit-01a","purpose":"構造検査","skills":["orth.alphabet.classical-basic"],"vocabulary":[],"blocks":[{"block_id":"objective","kind":"objective","new_concept_count":0,"skill_refs":["orth.alphabet.classical-basic"],"status":"planned"}],"source_refs":[],"evidence":[{"kind":"project-decision","claim_scope":"fixture structure","note":"本番本文ではない。","decision_id":"DEC-0011"}],"review":{"draft_status":"draft","source_checked":[],"editorial_approved":[],"expert_reviewed":[],"automated_validation":[]},"notes":"fixture only"}
