{
  "id":"lesson-unit-01c","schema_version":"1.0.0","content_version":"0.1.0","title":"1C アクセントと語尾の役割","created_at":"2026-08-25T12:00:00+09:00","updated_at":"2026-08-25T12:00:00+09:00","unit_id":"unit-01c","purpose":"基本アクセント、語尾の情報性、古典散文の範囲を識別する。","skills":["phon.accent.rule.basic","phon.macron-editorial-aid.recognize","morph.ending.grammatical-information","register.classical-prose.scope-recognize","phon.syllable.divide-basic","phon.word.read-aloud.basic"],"vocabulary":["lex-amicus","lex-dominus"],
  "blocks":[{"block_id":"objective","kind":"objective","new_concept_count":0,"skill_refs":["phon.accent.rule.basic"],"status":"review-ready"},{"block_id":"accent","kind":"explanation","new_concept_count":1,"skill_refs":["phon.accent.rule.basic"],"status":"review-ready"},{"block_id":"ending-information","kind":"explanation","new_concept_count":1,"skill_refs":["morph.ending.grammatical-information"],"status":"review-ready"},{"block_id":"course-register","kind":"function-note","new_concept_count":1,"skill_refs":["register.classical-prose.scope-recognize"],"status":"review-ready"},{"block_id":"unit-check","kind":"practice-link","new_concept_count":0,"skill_refs":["phon.macron-editorial-aid.recognize","phon.word.read-aloud.basic"],"status":"review-ready"}],
  "source_refs":[{"bibliography_id":"src-lat-ag-dcc","locator":{"section":"§12 Accents","url_fragment":"#accents"},"claim_scope":"二音節語と三音節以上の基本アクセント規則","quotation_used":false,"verification_status":"relevant-section-verified","verification_note":"2026-08-25にDCC本文を直接確認した。接語・例外は教材範囲外。","use_mode":"summary"},{"bibliography_id":"src-lat-ag-dcc","locator":{"section":"§§9–11 Quantity of Syllables","url_fragment":"#quantity-syllables"},"claim_scope":"マクロンが編集・学習上の補助であること","quotation_used":false,"verification_status":"relevant-section-verified","verification_note":"2026-08-25にDCC本文を直接確認した。","use_mode":"summary"}],
  "evidence":[{"kind":"source-summary","claim_scope":"アクセントとマクロン","note":"DCC版A&G §§9–12の要約。"},{"kind":"project-decision","claim_scope":"語尾概念と古典散文の範囲","note":"M2技能仕様とGOALS.mdに従う。","decision_id":"DEC-0014"}],
  "review":{"draft_status":"ready-for-review","source_checked":[{"id":"review-source-unit-01c-v1","kind":"source-checked","result":"pass","reviewer_type":"codex","reviewer_display_name":"Codex","reviewed_at":"2026-08-25T12:00:00+09:00","reviewed_content_version":"0.1.0","scope":["基本アクセント規則","マクロンの編集上の位置づけ"],"notes":"語尾概念の教材表現とレジスター説明は設計判断であり編集確認待ち。","evidence_refs":["src-lat-ag-dcc"],"active":true}],"editorial_approved":[],"expert_reviewed":[],"automated_validation":[]},"notes":"曲用・活用の生成を要求しない。"
}
