{
  "id":"lesson-unit-01b","schema_version":"1.0.0","content_version":"0.1.0","title":"1B 長母音・音節・音節量","created_at":"2026-08-25T12:00:00+09:00","updated_at":"2026-08-25T12:00:00+09:00","unit_id":"unit-01b","purpose":"母音長・音節区切り・音節量を区別する。","skills":["orth.macron.recognize","phon.syllable.divide-basic","phon.syllable.quantity.basic","phon.letter-sound.classical-basic","phon.word.read-aloud.basic"],"vocabulary":["lex-roma","lex-terra"],
  "blocks":[{"block_id":"objective","kind":"objective","new_concept_count":0,"skill_refs":["orth.macron.recognize"],"status":"review-ready"},{"block_id":"vowel-length","kind":"explanation","new_concept_count":1,"skill_refs":["orth.macron.recognize"],"status":"review-ready"},{"block_id":"syllable-division","kind":"explanation","new_concept_count":1,"skill_refs":["phon.syllable.divide-basic"],"status":"review-ready"},{"block_id":"syllable-quantity","kind":"explanation","new_concept_count":1,"skill_refs":["phon.syllable.quantity.basic"],"status":"review-ready"},{"block_id":"editorial-macrons","kind":"supplement","new_concept_count":1,"skill_refs":["orth.macron.recognize"],"status":"review-ready"}],
  "source_refs":[{"bibliography_id":"src-lat-ag-dcc","locator":{"section":"§7 Syllables","url_fragment":"#syllables"},"claim_scope":"音節数と基本的な分節規則","quotation_used":false,"verification_status":"relevant-section-verified","verification_note":"2026-08-25にDCC本文を直接確認した。","use_mode":"summary"},{"bibliography_id":"src-lat-ag-dcc","locator":{"section":"§§9–11 Quantity of Syllables","url_fragment":"#quantity-syllables"},"claim_scope":"母音長と音節量、nature/position、長母音表示","quotation_used":false,"verification_status":"relevant-section-verified","verification_note":"2026-08-25にDCC本文を直接確認した。","use_mode":"summary"}],
  "evidence":[{"kind":"source-summary","claim_scope":"1Bの主要説明","note":"DCC版A&G §§7, 9–11の要約。"}],
  "review":{"draft_status":"ready-for-review","source_checked":[{"id":"review-source-unit-01b-v1","kind":"source-checked","result":"pass","reviewer_type":"codex","reviewer_display_name":"Codex","reviewed_at":"2026-08-25T12:00:00+09:00","reviewed_content_version":"0.1.0","scope":["音節区切りの初歩","母音長と音節量の区別","本性と位置による長さ","長母音表示の位置づけ"],"notes":"複雑な子音群・例外・韻律は範囲外。","evidence_refs":["src-lat-ag-dcc"],"active":true}],"editorial_approved":[],"expert_reviewed":[],"automated_validation":[]},"notes":"日本語説明の平易さと例の選択は人間確認待ち。"
}
